{
  "$schema": "https://json-schema.org/draft/2020-12/schema",
  "type": "object",
  "properties": {
    "state": {
      "type": "string",
      "enum": [
        "inspect",
        "implemented",
        "missing",
        "partial",
        "blocked",
        "unknown"
      ]
    },
    "explanation": {
      "type": "string",
      "minLength": 12
    },
    "evidence": {
      "type": "array",
      "items": {
        "type": "object",
        "properties": {
          "path": {
            "type": "string"
          },
          "quote": {
            "type": "string",
            "minLength": 12
          }
        },
        "required": [
          "path",
          "quote"
        ],
        "additionalProperties": false
      }
    },
    "reads": {
      "maxItems": 10,
      "type": "array",
      "items": {
        "type": "object",
        "properties": {
          "path": {
            "type": "string"
          },
          "from": {
            "type": "integer",
            "exclusiveMinimum": 0,
            "maximum": 9007199254740991
          },
          "to": {
            "type": "integer",
            "exclusiveMinimum": 0,
            "maximum": 9007199254740991
          }
        },
        "required": [
          "path",
          "from",
          "to"
        ],
        "additionalProperties": false
      }
    },
    "searches": {
      "maxItems": 8,
      "type": "array",
      "items": {
        "type": "string",
        "minLength": 2
      }
    },
    "tests": {
      "maxItems": 12,
      "type": "array",
      "items": {
        "type": "string",
        "pattern": "^[A-Za-z_][A-Za-z0-9_.]+$"
      }
    },
    "writable": {
      "maxItems": 10,
      "type": "array",
      "items": {
        "type": "string"
      }
    }
  },
  "required": [
    "state",
    "explanation",
    "evidence",
    "reads",
    "searches",
    "tests",
    "writable"
  ],
  "additionalProperties": false
}
